"Judul Surat","Jenis","Instansi","Atribut Surat","Catatan Surat","Tanggal Surat","Nomor Surat"
"Laporan Limbah Covid-19445/1167/RSUD/IX/2021","Surat Masuk","RSUD Melawi","UmumUmumBiasa","","2 September 2021","445/1167/RSUD/IX/2021"
"Penyusunan Standar Pelayanan Publik060/923/ORG","Surat Masuk","Setda","UmumUmumSegera","","20 September 2021","060/923/ORG"
"Permintaan Data Inovasi Pelayanan Publik060/920/ORG","Surat Masuk","Sekretariat Daerah Kabupaten Melawi","Organisasi / Ketatal...UmumSegera","","20 September 2021","060/920/ORG"
"Permohonan usulan tenaga kesehatan teladan tahun 2021442/8769/Dinkes-sdk.c","Surat Masuk","Dinas kesehatan provinsi kalimantan barat","KesehatanUmumBiasa","","20 September 2021","442/8769/Dinkes-sdk.c"
"Uanganan123","Surat Masuk","dinas kearsipan","UmumUmumBiasa","","20 September 2021","123"
"Undangan Kegiatan Jambore Kader Posyandu005/899/Dinkes/2021","Surat Masuk","Sekretariat daerah Kab. Melawi","UndanganUmumBiasa","","3 September 2021","005/899/Dinkes/2021"
